Enter password: ****
Welcome to the MySQL monitor.  Commands end with ; or \g.
Your MySQL connection id is 8
Server version: 8.0.29 MySQL Community Server - GPL

Copyright (c) 2000, 2022, Oracle and/or its affiliates.

Oracle is a registered trademark of Oracle Corporation and/or its
affiliates. Other names may be trademarks of their respective
owners.

Type 'help;' or '\h' for help. Type '\c' to clear the current input statement.

mysql> show databases;
+--------------------+
| Database           |
+--------------------+
| information_schema |
| mysql              |
| performance_schema |
| sys                |
+--------------------+
4 rows in set (0.18 sec)

mysql> create database advancejava;
Query OK, 1 row affected (0.06 sec)

mysql> show databases;
+--------------------+
| Database           |
+--------------------+
| advancejava        |
| information_schema |
| mysql              |
| performance_schema |
| sys                |
+--------------------+
5 rows in set (0.00 sec)

mysql> use advancejava;
Database changed
mysql>



----------------------------------------------------


cmd to create table = 

create table emp(id int primary key, firstName varchar(45), lastName varchar(45), salary int, address varchar(50), company varchar(50));
Query OK, 0 rows affected (0.13 sec)

cmd to insert data = 

insert into emp values(1, 'Aryan', 'Shrivastav', 40000, 'Indore', 'NCS');
insert into emp values(2, 'Abhishek', 'Yadav', 50000, 'Bhopal', 'TCS'),(3, 'Ram', 'Sharma', 45000, 'Ujjain', 'BSNL');

cmd to search data = 

select * from emp;
select * from emp where firstName = 'Aryan';
select * from emp where id = 2;

cmd to update recoreds

update emp set address = 'Dewas' where id = 3;
update emp set salary = 60000 where id = 1;

cmd to delete a record

delete from emp where id = 1;


-----------------------------------------------

mysql> use advancejava;
Database changed
mysql> select * from emp;
+----+-----------+------------+--------+---------+---------+
| id | firstName | lastName   | salary | address | company |
+----+-----------+------------+--------+---------+---------+
|  1 | Aryan     | Shrivastav |  60000 | Indore  | NCS     |
|  2 | Abhishek  | Yadav      |  50000 | Bhopal  | TCS     |
|  3 | Ram       | Sharma     |  45000 | Ujjain  | BSNL    |
+----+-----------+------------+--------+---------+---------+
3 rows in set (0.02 sec)

mysql> insert into emp values(4, 'Kamal', 'Sharma', 35000, 'Indore', 'Rays'),(5, 'Uday', 'Dabi', 75000, 'Bhopal', 'TCS')
,(6, 'Shubham', 'Yadav', 30000, 'Indore', 'NCS'),(7, 'Paras', 'Mahajan', 80000, 'Banglore', 'TCS');
Query OK, 4 rows affected (0.03 sec)
Records: 4  Duplicates: 0  Warnings: 0

mysql> select * from emp;
+----+-----------+------------+--------+----------+---------+
| id | firstName | lastName   | salary | address  | company |
+----+-----------+------------+--------+----------+---------+
|  1 | Aryan     | Shrivastav |  60000 | Indore   | NCS     |
|  2 | Abhishek  | Yadav      |  50000 | Bhopal   | TCS     |
|  3 | Ram       | Sharma     |  45000 | Ujjain   | BSNL    |
|  4 | Kamal     | Sharma     |  35000 | Indore   | Rays    |
|  5 | Uday      | Dabi       |  75000 | Bhopal   | TCS     |
|  6 | Shubham   | Yadav      |  30000 | Indore   | NCS     |
|  7 | Paras     | Mahajan    |  80000 | Banglore | TCS     |
+----+-----------+------------+--------+----------+---------+
7 rows in set (0.00 sec)

mysql> select * from emp where firstName = 'Ram';
+----+-----------+----------+--------+---------+---------+
| id | firstName | lastName | salary | address | company |
+----+-----------+----------+--------+---------+---------+
|  3 | Ram       | Sharma   |  45000 | Ujjain  | BSNL    |
+----+-----------+----------+--------+---------+---------+
1 row in set (0.00 sec)

mysql> select * from emp;
+----+-----------+------------+--------+----------+---------+
| id | firstName | lastName   | salary | address  | company |
+----+-----------+------------+--------+----------+---------+
|  1 | Aryan     | Shrivastav |  60000 | Indore   | NCS     |
|  2 | Abhishek  | Yadav      |  50000 | Bhopal   | TCS     |
|  3 | Ram       | Sharma     |  45000 | Ujjain   | BSNL    |
|  4 | Kamal     | Sharma     |  35000 | Indore   | Rays    |
|  5 | Uday      | Dabi       |  75000 | Bhopal   | TCS     |
|  6 | Shubham   | Yadav      |  30000 | Indore   | NCS     |
|  7 | Paras     | Mahajan    |  80000 | Banglore | TCS     |
+----+-----------+------------+--------+----------+---------+
7 rows in set (0.00 sec)

mysql> select firstName from emp;
+-----------+
| firstName |
+-----------+
| Aryan     |
| Abhishek  |
| Ram       |
| Kamal     |
| Uday      |
| Shubham   |
| Paras     |
+-----------+
7 rows in set (0.00 sec)

mysql> select lastName from emp;
+------------+
| lastName   |
+------------+
| Shrivastav |
| Yadav      |
| Sharma     |
| Sharma     |
| Dabi       |
| Yadav      |
| Mahajan    |
+------------+
7 rows in set (0.00 sec)

mysql> select firstName, lastName from emp;
+-----------+------------+
| firstName | lastName   |
+-----------+------------+
| Aryan     | Shrivastav |
| Abhishek  | Yadav      |
| Ram       | Sharma     |
| Kamal     | Sharma     |
| Uday      | Dabi       |
| Shubham   | Yadav      |
| Paras     | Mahajan    |
+-----------+------------+
7 rows in set (0.00 sec)

mysql> select salary from emp;
+--------+
| salary |
+--------+
|  60000 |
|  50000 |
|  45000 |
|  35000 |
|  75000 |
|  30000 |
|  80000 |
+--------+
7 rows in set (0.00 sec)

mysql> select * from emp where salary > 40000;
+----+-----------+------------+--------+----------+---------+
| id | firstName | lastName   | salary | address  | company |
+----+-----------+------------+--------+----------+---------+
|  1 | Aryan     | Shrivastav |  60000 | Indore   | NCS     |
|  2 | Abhishek  | Yadav      |  50000 | Bhopal   | TCS     |
|  3 | Ram       | Sharma     |  45000 | Ujjain   | BSNL    |
|  5 | Uday      | Dabi       |  75000 | Bhopal   | TCS     |
|  7 | Paras     | Mahajan    |  80000 | Banglore | TCS     |
+----+-----------+------------+--------+----------+---------+
5 rows in set (0.02 sec)

mysql> select * from emp;
+----+-----------+------------+--------+----------+---------+
| id | firstName | lastName   | salary | address  | company |
+----+-----------+------------+--------+----------+---------+
|  1 | Aryan     | Shrivastav |  60000 | Indore   | NCS     |
|  2 | Abhishek  | Yadav      |  50000 | Bhopal   | TCS     |
|  3 | Ram       | Sharma     |  45000 | Ujjain   | BSNL    |
|  4 | Kamal     | Sharma     |  35000 | Indore   | Rays    |
|  5 | Uday      | Dabi       |  75000 | Bhopal   | TCS     |
|  6 | Shubham   | Yadav      |  30000 | Indore   | NCS     |
|  7 | Paras     | Mahajan    |  80000 | Banglore | TCS     |
+----+-----------+------------+--------+----------+---------+
7 rows in set (0.00 sec)

mysql> select * from emp limit 0,2;
+----+-----------+------------+--------+---------+---------+
| id | firstName | lastName   | salary | address | company |
+----+-----------+------------+--------+---------+---------+
|  1 | Aryan     | Shrivastav |  60000 | Indore  | NCS     |
|  2 | Abhishek  | Yadav      |  50000 | Bhopal  | TCS     |
+----+-----------+------------+--------+---------+---------+
2 rows in set (0.00 sec)

mysql> select * from emp limit 1,2;
+----+-----------+----------+--------+---------+---------+
| id | firstName | lastName | salary | address | company |
+----+-----------+----------+--------+---------+---------+
|  2 | Abhishek  | Yadav    |  50000 | Bhopal  | TCS     |
|  3 | Ram       | Sharma   |  45000 | Ujjain  | BSNL    |
+----+-----------+----------+--------+---------+---------+
2 rows in set (0.00 sec)

mysql> select * from emp limit 0,4;
+----+-----------+------------+--------+---------+---------+
| id | firstName | lastName   | salary | address | company |
+----+-----------+------------+--------+---------+---------+
|  1 | Aryan     | Shrivastav |  60000 | Indore  | NCS     |
|  2 | Abhishek  | Yadav      |  50000 | Bhopal  | TCS     |
|  3 | Ram       | Sharma     |  45000 | Ujjain  | BSNL    |
|  4 | Kamal     | Sharma     |  35000 | Indore  | Rays    |
+----+-----------+------------+--------+---------+---------+
4 rows in set (0.00 sec)

mysql> select * from emp limit 2,4;
+----+-----------+----------+--------+---------+---------+
| id | firstName | lastName | salary | address | company |
+----+-----------+----------+--------+---------+---------+
|  3 | Ram       | Sharma   |  45000 | Ujjain  | BSNL    |
|  4 | Kamal     | Sharma   |  35000 | Indore  | Rays    |
|  5 | Uday      | Dabi     |  75000 | Bhopal  | TCS     |
|  6 | Shubham   | Yadav    |  30000 | Indore  | NCS     |
+----+-----------+----------+--------+---------+---------+
4 rows in set (0.00 sec)

mysql> select * from emp;
+----+-----------+------------+--------+----------+---------+
| id | firstName | lastName   | salary | address  | company |
+----+-----------+------------+--------+----------+---------+
|  1 | Aryan     | Shrivastav |  60000 | Indore   | NCS     |
|  2 | Abhishek  | Yadav      |  50000 | Bhopal   | TCS     |
|  3 | Ram       | Sharma     |  45000 | Ujjain   | BSNL    |
|  4 | Kamal     | Sharma     |  35000 | Indore   | Rays    |
|  5 | Uday      | Dabi       |  75000 | Bhopal   | TCS     |
|  6 | Shubham   | Yadav      |  30000 | Indore   | NCS     |
|  7 | Paras     | Mahajan    |  80000 | Banglore | TCS     |
+----+-----------+------------+--------+----------+---------+
7 rows in set (0.00 sec)

mysql> select * from emp order by salary desc;
+----+-----------+------------+--------+----------+---------+
| id | firstName | lastName   | salary | address  | company |
+----+-----------+------------+--------+----------+---------+
|  7 | Paras     | Mahajan    |  80000 | Banglore | TCS     |
|  5 | Uday      | Dabi       |  75000 | Bhopal   | TCS     |
|  1 | Aryan     | Shrivastav |  60000 | Indore   | NCS     |
|  2 | Abhishek  | Yadav      |  50000 | Bhopal   | TCS     |
|  3 | Ram       | Sharma     |  45000 | Ujjain   | BSNL    |
|  4 | Kamal     | Sharma     |  35000 | Indore   | Rays    |
|  6 | Shubham   | Yadav      |  30000 | Indore   | NCS     |
+----+-----------+------------+--------+----------+---------+
7 rows in set (0.00 sec)

mysql> select * from emp order by salary asc;
+----+-----------+------------+--------+----------+---------+
| id | firstName | lastName   | salary | address  | company |
+----+-----------+------------+--------+----------+---------+
|  6 | Shubham   | Yadav      |  30000 | Indore   | NCS     |
|  4 | Kamal     | Sharma     |  35000 | Indore   | Rays    |
|  3 | Ram       | Sharma     |  45000 | Ujjain   | BSNL    |
|  2 | Abhishek  | Yadav      |  50000 | Bhopal   | TCS     |
|  1 | Aryan     | Shrivastav |  60000 | Indore   | NCS     |
|  5 | Uday      | Dabi       |  75000 | Bhopal   | TCS     |
|  7 | Paras     | Mahajan    |  80000 | Banglore | TCS     |
+----+-----------+------------+--------+----------+---------+
7 rows in set (0.00 sec)

mysql> select * from emp order by fristName asc;
ERROR 1054 (42S22): Unknown column 'fristName' in 'order clause'
mysql> select * from emp order by firstName asc;
+----+-----------+------------+--------+----------+---------+
| id | firstName | lastName   | salary | address  | company |
+----+-----------+------------+--------+----------+---------+
|  2 | Abhishek  | Yadav      |  50000 | Bhopal   | TCS     |
|  1 | Aryan     | Shrivastav |  60000 | Indore   | NCS     |
|  4 | Kamal     | Sharma     |  35000 | Indore   | Rays    |
|  7 | Paras     | Mahajan    |  80000 | Banglore | TCS     |
|  3 | Ram       | Sharma     |  45000 | Ujjain   | BSNL    |
|  6 | Shubham   | Yadav      |  30000 | Indore   | NCS     |
|  5 | Uday      | Dabi       |  75000 | Bhopal   | TCS     |
+----+-----------+------------+--------+----------+---------+
7 rows in set (0.02 sec)

mysql> select * from emp order by salary desc;
+----+-----------+------------+--------+----------+---------+
| id | firstName | lastName   | salary | address  | company |
+----+-----------+------------+--------+----------+---------+
|  7 | Paras     | Mahajan    |  80000 | Banglore | TCS     |
|  5 | Uday      | Dabi       |  75000 | Bhopal   | TCS     |
|  1 | Aryan     | Shrivastav |  60000 | Indore   | NCS     |
|  2 | Abhishek  | Yadav      |  50000 | Bhopal   | TCS     |
|  3 | Ram       | Sharma     |  45000 | Ujjain   | BSNL    |
|  4 | Kamal     | Sharma     |  35000 | Indore   | Rays    |
|  6 | Shubham   | Yadav      |  30000 | Indore   | NCS     |
+----+-----------+------------+--------+----------+---------+
7 rows in set (0.00 sec)

mysql> select * from emp order by salary desc limit 1,1;
+----+-----------+----------+--------+---------+---------+
| id | firstName | lastName | salary | address | company |
+----+-----------+----------+--------+---------+---------+
|  5 | Uday      | Dabi     |  75000 | Bhopal  | TCS     |
+----+-----------+----------+--------+---------+---------+
1 row in set (0.00 sec)

mysql> select * from emp order by salary acd limit 1,1;
ERROR 1064 (42000): You have an error in your SQL syntax; check the manual that corresponds to your MySQL server version for the right syntax to use near 'acd limit 1,1' at line 1
mysql> select * from emp order by salary asc limit 1,1;
+----+-----------+----------+--------+---------+---------+
| id | firstName | lastName | salary | address | company |
+----+-----------+----------+--------+---------+---------+
|  4 | Kamal     | Sharma   |  35000 | Indore  | Rays    |
+----+-----------+----------+--------+---------+---------+
1 row in set (0.00 sec)

mysql>

marksheet=================================

mysql> use result;
Database changed
mysql> create table marksheet(id int primary key, rollNo int unique, name varchar(45), physics int, chemistry int, maths int);
Query OK, 0 rows affected (0.12 sec)

mysql> insert into marksheet values(1, 101, 'Naman Meena', 65, 78, 72);
Query OK, 1 row affected (0.04 sec)

mysql> select * from marksheet;
+----+--------+-------------+---------+-----------+-------+
| id | rollNo | name        | physics | chemistry | maths |
+----+--------+-------------+---------+-----------+-------+
|  1 |    101 | Naman Meena |      65 |        78 |    72 |
+----+--------+-------------+---------+-----------+-------+
1 row in set (0.00 sec)

mysql> insert into marksheet values(2, 102, 'Sachin Kalar', 47, 52, 45);
Query OK, 1 row affected (0.04 sec)

mysql> insert into marksheet values(3, 103, 'Pawan Rajput', 74, 78, 88);
Query OK, 1 row affected (0.03 sec)

mysql> insert into marksheet values(4, 104, 'Raman Sharma', 15, 32, 23);
Query OK, 1 row affected (0.04 sec)

mysql> insert into marksheet values(4, 104, 'Raman Sharma', 62, 45, 35);
ERROR 1062 (23000): Duplicate entry '4' for key 'marksheet.PRIMARY'
mysql> insert into marksheet values(5, 104, 'Raman Sharma', 62, 45, 35);
ERROR 1062 (23000): Duplicate entry '104' for key 'marksheet.rollNo'
mysql> insert into marksheet values(5, 105, 'Raman Sharma', 62, 45, 35);
Query OK, 1 row affected (0.03 sec)

mysql> insert into marksheet values(6, 106, 'Khushali Rathod', 52, 33, 25);
Query OK, 1 row affected (0.04 sec)

mysql> select * from marksheet;
+----+--------+-----------------+---------+-----------+-------+
| id | rollNo | name            | physics | chemistry | maths |
+----+--------+-----------------+---------+-----------+-------+
|  1 |    101 | Naman Meena     |      65 |        78 |    72 |
|  2 |    102 | Sachin Kalar    |      47 |        52 |    45 |
|  3 |    103 | Pawan Rajput    |      74 |        78 |    88 |
|  4 |    104 | Raman Sharma    |      15 |        32 |    23 |
|  5 |    105 | Raman Sharma    |      62 |        45 |    35 |
|  6 |    106 | Khushali Rathod |      52 |        33 |    25 |
+----+--------+-----------------+---------+-----------+-------+
6 rows in set (0.00 sec)

mysql> insert into marksheet values(7, 107, 'Anish Malwiya', 63, 75, 52);
Query OK, 1 row affected (0.04 sec)

mysql> update marksheet set name = 'Raj Jaat' where id = 4
    -> ;
Query OK, 1 row affected (0.04 sec)
Rows matched: 1  Changed: 1  Warnings: 0

mysql> select * from marksheet;
+----+--------+-----------------+---------+-----------+-------+
| id | rollNo | name            | physics | chemistry | maths |
+----+--------+-----------------+---------+-----------+-------+
|  1 |    101 | Naman Meena     |      65 |        78 |    72 |
|  2 |    102 | Sachin Kalar    |      47 |        52 |    45 |
|  3 |    103 | Pawan Rajput    |      74 |        78 |    88 |
|  4 |    104 | Raj Jaat        |      15 |        32 |    23 |
|  5 |    105 | Raman Sharma    |      62 |        45 |    35 |
|  6 |    106 | Khushali Rathod |      52 |        33 |    25 |
|  7 |    107 | Anish Malwiya   |      63 |        75 |    52 |
+----+--------+-----------------+---------+-----------+-------+
7 rows in set (0.00 sec)

mysql> select *, (physics+chemistry+maths) as total from marksheet;
+----+--------+-----------------+---------+-----------+-------+-------+
| id | rollNo | name            | physics | chemistry | maths | total |
+----+--------+-----------------+---------+-----------+-------+-------+
|  1 |    101 | Naman Meena     |      65 |        78 |    72 |   215 |
|  2 |    102 | Sachin Kalar    |      47 |        52 |    45 |   144 |
|  3 |    103 | Pawan Rajput    |      74 |        78 |    88 |   240 |
|  4 |    104 | Raj Jaat        |      15 |        32 |    23 |    70 |
|  5 |    105 | Raman Sharma    |      62 |        45 |    35 |   142 |
|  6 |    106 | Khushali Rathod |      52 |        33 |    25 |   110 |
|  7 |    107 | Anish Malwiya   |      63 |        75 |    52 |   190 |
+----+--------+-----------------+---------+-----------+-------+-------+
7 rows in set (0.03 sec)

mysql> select * from marksheet;
+----+--------+-----------------+---------+-----------+-------+
| id | rollNo | name            | physics | chemistry | maths |
+----+--------+-----------------+---------+-----------+-------+
|  1 |    101 | Naman Meena     |      65 |        78 |    72 |
|  2 |    102 | Sachin Kalar    |      47 |        52 |    45 |
|  3 |    103 | Pawan Rajput    |      74 |        78 |    88 |
|  4 |    104 | Raj Jaat        |      15 |        32 |    23 |
|  5 |    105 | Raman Sharma    |      62 |        45 |    35 |
|  6 |    106 | Khushali Rathod |      52 |        33 |    25 |
|  7 |    107 | Anish Malwiya   |      63 |        75 |    52 |
+----+--------+-----------------+---------+-----------+-------+
7 rows in set (0.00 sec)

mysql> select *, (physics+chemistry+maths) as total from marksheet;
+----+--------+-----------------+---------+-----------+-------+-------+
| id | rollNo | name            | physics | chemistry | maths | total |
+----+--------+-----------------+---------+-----------+-------+-------+
|  1 |    101 | Naman Meena     |      65 |        78 |    72 |   215 |
|  2 |    102 | Sachin Kalar    |      47 |        52 |    45 |   144 |
|  3 |    103 | Pawan Rajput    |      74 |        78 |    88 |   240 |
|  4 |    104 | Raj Jaat        |      15 |        32 |    23 |    70 |
|  5 |    105 | Raman Sharma    |      62 |        45 |    35 |   142 |
|  6 |    106 | Khushali Rathod |      52 |        33 |    25 |   110 |
|  7 |    107 | Anish Malwiya   |      63 |        75 |    52 |   190 |
+----+--------+-----------------+---------+-----------+-------+-------+
7 rows in set (0.00 sec)

mysql> select *, (physics+chemistry+maths) as total, ((physics+chemistry+maths)/3) from marksheet;
+----+--------+-----------------+---------+-----------+-------+-------+-------------------------------+
| id | rollNo | name            | physics | chemistry | maths | total | ((physics+chemistry+maths)/3) |
+----+--------+-----------------+---------+-----------+-------+-------+-------------------------------+
|  1 |    101 | Naman Meena     |      65 |        78 |    72 |   215 |                       71.6667 |
|  2 |    102 | Sachin Kalar    |      47 |        52 |    45 |   144 |                       48.0000 |
|  3 |    103 | Pawan Rajput    |      74 |        78 |    88 |   240 |                       80.0000 |
|  4 |    104 | Raj Jaat        |      15 |        32 |    23 |    70 |                       23.3333 |
|  5 |    105 | Raman Sharma    |      62 |        45 |    35 |   142 |                       47.3333 |
|  6 |    106 | Khushali Rathod |      52 |        33 |    25 |   110 |                       36.6667 |
|  7 |    107 | Anish Malwiya   |      63 |        75 |    52 |   190 |                       63.3333 |
+----+--------+-----------------+---------+-----------+-------+-------+-------------------------------+
7 rows in set (0.00 sec)

mysql> select *, (physics+chemistry+maths) as total, ((physics+chemistry+maths)/3) as percentage from marksheet;
+----+--------+-----------------+---------+-----------+-------+-------+------------+
| id | rollNo | name            | physics | chemistry | maths | total | percentage |
+----+--------+-----------------+---------+-----------+-------+-------+------------+
|  1 |    101 | Naman Meena     |      65 |        78 |    72 |   215 |    71.6667 |
|  2 |    102 | Sachin Kalar    |      47 |        52 |    45 |   144 |    48.0000 |
|  3 |    103 | Pawan Rajput    |      74 |        78 |    88 |   240 |    80.0000 |
|  4 |    104 | Raj Jaat        |      15 |        32 |    23 |    70 |    23.3333 |
|  5 |    105 | Raman Sharma    |      62 |        45 |    35 |   142 |    47.3333 |
|  6 |    106 | Khushali Rathod |      52 |        33 |    25 |   110 |    36.6667 |
|  7 |    107 | Anish Malwiya   |      63 |        75 |    52 |   190 |    63.3333 |
+----+--------+-----------------+---------+-----------+-------+-------+------------+
7 rows in set (0.00 sec)

mysql> select *, (physics+chemistry+maths) as total, (physics+chemistry+maths/3) as percentage from marksheet;
+----+--------+-----------------+---------+-----------+-------+-------+------------+
| id | rollNo | name            | physics | chemistry | maths | total | percentage |
+----+--------+-----------------+---------+-----------+-------+-------+------------+
|  1 |    101 | Naman Meena     |      65 |        78 |    72 |   215 |   167.0000 |
|  2 |    102 | Sachin Kalar    |      47 |        52 |    45 |   144 |   114.0000 |
|  3 |    103 | Pawan Rajput    |      74 |        78 |    88 |   240 |   181.3333 |
|  4 |    104 | Raj Jaat        |      15 |        32 |    23 |    70 |    54.6667 |
|  5 |    105 | Raman Sharma    |      62 |        45 |    35 |   142 |   118.6667 |
|  6 |    106 | Khushali Rathod |      52 |        33 |    25 |   110 |    93.3333 |
|  7 |    107 | Anish Malwiya   |      63 |        75 |    52 |   190 |   155.3333 |
+----+--------+-----------------+---------+-----------+-------+-------+------------+
7 rows in set (0.00 sec)

mysql> select *, (physics+chemistry+maths) as total, ((physics+chemistry+maths)/3) as percentage from marksheet;
+----+--------+-----------------+---------+-----------+-------+-------+------------+
| id | rollNo | name            | physics | chemistry | maths | total | percentage |
+----+--------+-----------------+---------+-----------+-------+-------+------------+
|  1 |    101 | Naman Meena     |      65 |        78 |    72 |   215 |    71.6667 |
|  2 |    102 | Sachin Kalar    |      47 |        52 |    45 |   144 |    48.0000 |
|  3 |    103 | Pawan Rajput    |      74 |        78 |    88 |   240 |    80.0000 |
|  4 |    104 | Raj Jaat        |      15 |        32 |    23 |    70 |    23.3333 |
|  5 |    105 | Raman Sharma    |      62 |        45 |    35 |   142 |    47.3333 |
|  6 |    106 | Khushali Rathod |      52 |        33 |    25 |   110 |    36.6667 |
|  7 |    107 | Anish Malwiya   |      63 |        75 |    52 |   190 |    63.3333 |
+----+--------+-----------------+---------+-----------+-------+-------+------------+
7 rows in set (0.00 sec)

mysql>